{
  "assignment_uri": "https://grip.opdrachtgever.example/id/opdracht/3f2a8c54-6d1b-4f0e-9a77-1c2b3d4e5f60",
  "as_of": "2026-09-30",
  "year": 2026,
  "budgeted": {
    "amount_cents": 125000000,
    "currency": "EUR"
  },
  "used": {
    "amount_cents": 110000000,
    "currency": "EUR"
  },
  "available": {
    "amount_cents": 15000000,
    "currency": "EUR"
  },
  "lines": [
    {
      "description": "Productmanager",
      "budgeted": {
        "amount_cents": 17280000,
        "currency": "EUR"
      },
      "used": {
        "amount_cents": 18000000,
        "currency": "EUR"
      },
      "available": {
        "amount_cents": -720000,
        "currency": "EUR"
      }
    }
  ]
}
